Title,Description,Credits,Prerequisites
COMP SCI/E C E  766 — COMPUTER VISION,"Fundamentals of image analysis and computer vision; image acquisition and geometry; image enhancement; recovery of physical scene characteristics; shape-from techniques; segmentation and perceptual organization; representation and description of two-dimensional objects; shape analysis; texture analysis; goal-directed and model-based systems; parallel algorithms and special-purpose architectures. Students are strongly encouraged to have basic proficiency in calculus and linear algebra, such as MATH 340, and basic programming such as COMP SCI 300.",3 credits.,None
COMP SCI/B M I  767 — COMPUTATIONAL METHODS FOR MEDICAL IMAGE ANALYSIS,"Study of computational techniques that facilitate automated analysis, manipulation, denoising, and improvement of large-scale and high resolution medical images. Design and implementation of methods from computer Vision and Machine Learning to efficiently process such image data to answer biologically and clinically meaningful scientific questions. Students are strongly encouraged to have programming skills and basic proficiency in calculus and linear algebra, such as MATH 340.",3 credits.,None
COMP SCI 769 — ADVANCED NATURAL LANGUAGE PROCESSING,"Develop algorithms and mathematical models for natural language processing tasks, including text categorization, information retrieval, speech recognition, machine translation, and information extraction. Focus is on the state-of-the-art computational techniques as they are applied to natural language tasks.  Students are strongly encouraged to have knowledge of introductory artificial intelligence (e.g., COMP SCI 540).",3 credits.,None
COMP SCI/ED PSYCH/PSYCH  770 — HUMAN-COMPUTER INTERACTION,"Principles of human-computer interaction (HCI); human subjects research methods and procedures, qualitative and quantitative data analysis; and semester-long research project situated in critical domains of HCI, including applications in ubiquitous, affective, assistive, social, and embodied computing.",3 credits.,None
COMP SCI/B M I  771 — LEARNING BASED METHODS FOR COMPUTER VISION,"Addresses the problems of representation and reasoning for large amounts of visual data, including images and videos, medical imaging data, and their associated tags or text descriptions. Introduces deep learning in the context of computer vision. Covers topics on visual recognition using deep models, such as image classification, object detection, human pose estimation, action recognition, 3D understanding, and medical image analysis. Emphasizes the design of vision and learning algorithms and models, as well as their practical implementations. Strongly recommended to have knowledge in computer vision or machine learning [such as COMP SCI 540] or medical image analysis [such as B M I / COMP SCI/B M I  567].",3 credits.,None
"COMP SCI 774 — DATA EXPLORATION, CLEANING, AND INTEGRATION FOR DATA SCIENCE","Big Data is often said to deal with four Vs: volume, velocity, variety, and veracity. The focus is on variety and veracity challenges, which often arise in data science projects. In many such projects, data is often incorrect, hard to understand, and come from a variety of sources. Data scientists often spend 80% of their effort to explore, clean, and integrate this data, before analysis can be carried out to extract insights. As a result, managing variety and veracity has received significant attention. Study these topics, understand their challenges, and discuss solutions. These solutions often require data management, machine learning, big data scaling, cloud, crowdsourcing, and user interaction techniques. Knowledge of machine learning/AI [COMP SCI 540], databases [COMP SCI 564] and Python [COMP SCI 320] recommended.",3 credits.,None
COMP SCI/B M I  775 — COMPUTATIONAL NETWORK BIOLOGY,"Introduces networks as a powerful representation in many real-world domains including biology and biomedicine. Encompasses theory and applications of networks, also referred to as graphs, to study complex systems such as living organisms. Surveys the current literature on computational, graph-theoretic approaches that use network algorithms for biological modeling, analysis, interpretation, and discovery. Enables hands-on experience in network biology by implementing computational projects.",3 credits.,None
COMP SCI/B M I  776 — ADVANCED BIOINFORMATICS,"Advanced course covering computational problems in molecular biology. The course will study algorithms for problems such as: modeling sequence classes and features, phylogenetic tree construction, gene-expression data analysis, protein and RNA structure prediction, and whole-genome analysis and comparisons.",3 credits.,None
COMP SCI/E C E  782 — ADVANCED COMPUTER SECURITY AND PRIVACY,"Security and privacy issues in software, networks, and hardware systems. Security vulnerabilities, privacy threats, threats modeling, and mitigation strategies. Privacy issues related to user interaction with devices, online systems, and networks. In addition, a selection of more advanced topics will be covered. Possible examples include applied cryptography in the context of systems, security and privacy policies, user authentication, and cyber-physical systems. Builds on prior experiences with one or more of the following: networking, security, modern machine learning, embedded systems, and mobile computing.",3 credits.,None
COMP SCI 784 — FOUNDATIONS OF DATA MANAGEMENT,"Foundational concepts in databases and data management. The first part of the course discusses topics on query languages (conjunctive queries, Datalog), their expressivity and complexity of evaluation. The second part studies advanced topics in modern data management, including data streams, massive parallelism, provenance, uncertain data management and privacy. There are no specific course prerequisites. It is strongly encouraged that the students are familiar with databases and relational algebra (COMP SCI 564 or equivalent). Knowledge of algorithms, complexity theory and probability will also be helpful.",3 credits.,None
COMP SCI 787 — ADVANCED ALGORITHMS,"Advanced paradigms for the design and analysis of efficient algorithms, including the use of randomness, linear programming, and semi-definite programming. Applications to data structures, approximating NP-hard optimization problems, learning, on-line and distributed problems.  Students are strongly encouraged to have introductory knowledge of algorithms (e.g., COMP SCI 577)",3 credits.,None
COMP SCI 790 — MASTER'S THESIS,Grad st; Master's candidates only,1-9 credits.,None
COMP SCI 799 — MASTER'S RESEARCH,,1-9 credits.,None
COMP SCI 809 — MATHEMATICAL TECHNIQUES IN THE ANALYSIS OF ALGORITHMS,"Techniques for quantitative analysis of algorithms. Charging arguments, amortization, probabilistic methods. Adversary and information lower bounds. Use of methods from combinatorics, complex analysis, and asymptotics in obtaining precise analyses of quicksort, chained hashing, and other algorithms.  Students are strongly encouraged to have knowledge of algorithms (e.g., COMP SCI 577) or applied math analysis (e.g., MATH 321) and theory of probability (e.g., MATH/STAT  431).",3 credits.,None
COMP SCI 812 — ARITHMETIC ALGORITHMS,"Survey of algorithms and design paradigms for exact arithmetic, as used in public-key cryptography, computer algebra, and pseudo-random number generation. Topics include primality testing, factorization of integers and polynomials, discrete logarithms, and (optionally) elliptic curves and integer lattices.  Students are strongly encourage to have knowledge of basic abstract algebra (e.g., MATH 541), and intermediate programming ability (e.g., COMP SCI 367 or COMP SCI 300).",3 credits.,None
COMP SCI 838 — TOPICS IN COMPUTING,Advanced topics of special interest to students in various areas of Computer Science. Each offering of the course will cover a topic selected by the instructor. Credit varies by offering - check with the department to determine how an offering counts toward degree requirements.,1-3 credits.,None
COMP SCI 839 — CORE TOPICS IN COMPUTING,Topics selected from advanced areas.,3 credits.,None
COMP SCI/B M I/PSYCH  841 — COMPUTATIONAL COGNITIVE SCIENCE,"Studies the biological and computational basis of intelligence, by combining methods from cognitive science, artificial intelligence, machine learning, computational biology, and cognitive neuroscience. Requires ability to program.",3 credits.,None
COMP SCI/E C E/STAT  861 — THEORETICAL FOUNDATIONS OF MACHINE LEARNING,"Advanced mathematical theory and methods of machine learning. Statistical learning theory, Vapnik-Chevronenkis Theory, model selection, high-dimensional models, nonparametric methods, probabilistic analysis, optimization, learning paradigms.",3 credits.,ECE 830
COMP SCI 880 — TOPICS IN THEORETICAL COMPUTER SCIENCE,"Advanced topics in algorithms, complexity, and cryptography. The exact topic varies.",3 credits.,None
COMP SCI 899 — PRE-DISSERTATOR RESEARCH,Independent research supervised by a faculty member for students who have completed a master's degree but have not reached dissertator status.,1-9 credits.,None
COMP SCI 900 — ADVANCED SEMINAR IN COMPUTER SCIENCE,Seminar on recent research on various aspects of computer science.,0-1 credits.,None
COMP SCI/B M E/B M I/BIOCHEM/CBE/GENETICS  915 — COMPUTATION AND INFORMATICS IN BIOLOGY AND MEDICINE,Participants and outside speakers will discuss current research in computation and informatics in biology and medicine. This seminar is required of all CIBM program trainees.,1 credit.,None
COMP SCI 990 — DISSERTATION,Advanced level mentored reading and research for students with dissertator status.,1-6 credits.,None
COMP SCI 999 — DISSERTATOR RESEARCH,Advanced level mentored reading and research for dissertators.,1-6 credits.,None