title,description,credits,prerequisites,Compulsory,mathcompulsory,Linear Algebra,Probability or Statistics,Theory of CS,Software and hardware,Applications,Electives
COMP SCI 640 — INTRODUCTION TO COMPUTER NETWORKS,"Architecture of computer networks and network protocols, protocol layering, reliable transmission, congestion control, flow control, naming and addressing, unicast and multicast routing, network security, network performance widely used protocols such as Ethernet, wireless LANs, IP, TCP, and HTTP.",3,COMP SCI 537,,,,,,Yes,,Yes
COMP SCI 642 — INTRODUCTION TO INFORMATION SECURITY,"Senior level undergraduate course covering various topics on information security. Covers a wide range of topics, such as cryptographic primitives, security protocols, system security, and emerging topics.  Elementary knowledge of mathematical logic and discrete probability theory needed, such as MATH/COMP COMP SCI  240.",3, COMP SCI 537,,,,,,Yes,,Yes
STAT 240 — DATA SCIENCE MODELING I,"Introduces reproducible data management, modeling, analysis, and statistical inference through a practical, hands-on case studies approach. Topics include the use of an integrated statistical computing environment, data wrangling, the R programming language, data graphics and visualization, random variables and concepts of probability including the binomial and normal distributions, data modeling, statistical inference in one- and two- sample settings for proportions and means, simple linear regression, and report generation using R Markdown with applications to a wide variety of data to address open-ended questions.",4,,,,,,,,,
STAT 340 — DATA SCIENCE MODELING II,"Teaches how to explore, model, and analyze data using R. Topics include basic probability models; the central limit theorem; Monte Carlo simulation; one- and two-sample hypothesis testing; Bayesian inference; linear and logistic regression; ANOVA; the bootstrap; random forests and cross-validation. Features the analysis of real-world data sets and the communication of findings in a clear and reproducible manner within a project setting.",4,"MATH 211, MATH 221, STAT 240",,,,Yes,,,,
STAT 371 — INTRODUCTORY APPLIED STATISTICS FOR THE LIFE SCIENCES,"Introduction to modern statistical practice in the life sciences, using the R programming language. Topics include: exploratory data analysis, probability and random variables; one-sample testing and confidence intervals, role of assumptions, sample size determination, two-sample inference; basic ideas in experimental design, analysis of variance, linear regression, goodness-of fit; biological applications.",3,"MATH 112, MATH 113, MATH 113, MATH 112, MATH 112, and MATH 113, MATH 114, or 221, MATH 221, STAT 302, STAT 324",,,,Yes,,,,
STAT/MATH  431 — INTRODUCTION TO THE THEORY OF PROBABILITY,"Topics covered include axioms of probability, random variables, the most important discrete and continuous probability distributions, expectation and variance, moment generating functions, conditional probability and conditional expectations, multivariate distributions, Markov's and Chebyshev's inequalities, laws of large numbers, and the central limit theorem.",3,"MATH 234, MATH 376",,,,Yes,,,,
MATH 221 — CALCULUS AND ANALYTIC GEOMETRY 1,Introduction to differential and integral calculus and plane analytic geometry; applications; transcendental functions.,5,,,Yes,,,,,,
MATH 222 — CALCULUS AND ANALYTIC GEOMETRY 2,"Techniques of integration, improper integrals, first order ordinary differential equations, sequences and series, Taylor series, vector geometry in two and three dimensions.",4,MATH 221,,Yes,,,,,,
MATH 234 — CALCULUS--FUNCTIONS OF SEVERAL VARIABLES,"Introduction to calculus of functions of several variables; calculus on parameterized curves, derivatives of functions of several variables, multiple integrals, vector calculus.",4,MATH 222,,,,,,,,
MATH/COMP SCI  240 — INTRODUCTION TO DISCRETE MATHEMATICS,"Basic concepts of logic, sets, partial order and other relations, and functions. Basic concepts of mathematics (definitions, proofs, sets, functions, and relations) with a focus on discrete structures: integers, bits, strings, trees, and graphs.  Propositional logic, Boolean algebra, and predicate logic. Mathematical induction and recursion. Invariants and algorithmic correctness. Recurrences and asymptotic growth analysis. Fundamentals of counting.",3,MATH 217 or MATH 221,,,,,,,,
MATH 319 — TECHNIQUES IN ORDINARY DIFFERENTIAL EQUATIONS,Review of linear differential equations; series solution of linear differential equations; boundary value problems; Laplace transforms; possibly numerical methods and two dimensional autonomous systems.,3,MATH 222,,,,,,,,
MATH 320 — LINEAR ALGEBRA AND DIFFERENTIAL EQUATIONS,"An introduction to linear algebra and differential equations with emphasis on the relationship between the theory of linear algebra and analytical and numerical techniques for solving differential equations. Linear algebra topics include linear systems, matrices and their algebra, vector spaces and linear transformations, eigenvalues and eigenvectors. Topics from differential equations include first order ODE, homogeneous and nonhomogeneous linear systems, and numerical methods.",3,MATH 222,,,Yes,,,,,
MATH 331 — INTRODUCTORY PROBABILITY,"Topics covered include axioms of probability, random variables, the most important discrete and continuous probability distributions, expectation and variance, conditional probability and conditional expectations, Markov's and Chebyshev's inequalities, laws of large numbers, and the central limit theorem. Includes a brief introduction to techniques of multivariate integration.",3,MATH 213 or MATH 222,,,,Yes,,,,
MATH 340 — ELEMENTARY MATRIX AND LINEAR ALGEBRA,"An introduction to linear algebra. Topics include matrix algebra, linear systems of equations, vector spaces, sub-spaces, linear dependence, span, basis, rank of matrices, determinants, linear transformations, coordinate representations, kernel, range, eigenvalues and eigenvectors, diagonalization, inner products and orthogonal vectors, symmetric matrices. Covers linear algebra topics in greater depth and detail than MATH 320. Formal techniques in mathematical argument [MATH 341] not covered.",3,MATH 222,,,Yes,,,,,
MATH 341 — LINEAR ALGEBRA,"The theory of linear algebra with an introduction to proofs and proof writing. Topics include vector spaces, linear dependence, span, basis, linear transformations, kernel, image, inner products and inner product spaces, geometry, eigenvalues, eigenvectors, standard matrix factorizations. Other content includes basic set theory, logical operations, quantifiers, direct and indirect arguments, and induction. Differential equations [MATH 320] not covered.",3,MATH 234,,,Yes,,,,,
