Title,Description,Credits,Prerequisites
COMP SCI/L I S  102 — INTRODUCTION TO COMPUTING,"Provides a broad overview of computing at an introductory level, including topics such as security, robotics, and artificial intelligence. Increases understanding of how computers work and how algorithms solve problems. Design and implement creative applications in an introductory coding environment. Provides a broad overview of computing and algorithms without an emphasis on programming.",3 credits.,"MATH 96, MATH 141, MATH 118, COMP SCI 300 or COMP SCI 320"
COMP SCI 200 — PROGRAMMING I,"Learn the process of incrementally developing small (200-500 lines) programs along with the fundamental Computer Science topics. These topics include: problem abstraction and decomposition, the edit-compile-run cycle, using variables of primitive and more complex data types, conditional and loop-based flow control, basic testing and debugging techniques, how to define and call functions (methods), and IO processing techniques. Also teaches and reinforces good programming practices including the use of a consistent style, and meaningful documentation. Intended for students who have no prior programming experience.",3 credits.,None
COMP SCI 220 — DATA SCIENCE PROGRAMMING I,Introduction to Data Science programming using Python.  No previous programming experience required.  Emphasis on analyzing real datasets in a variety of forms and visual communication.,4 credits., COMP SCI 301
COMP SCI/MATH  240 — INTRODUCTION TO DISCRETE MATHEMATICS,"Basic concepts of logic, sets, partial order and other relations, and functions. Basic concepts of mathematics (definitions, proofs, sets, functions, and relations) with a focus on discrete structures: integers, bits, strings, trees, and graphs.  Propositional logic, Boolean algebra, and predicate logic. Mathematical induction and recursion. Invariants and algorithmic correctness. Recurrences and asymptotic growth analysis. Fundamentals of counting.",3 credits.,"MATH 217, MATH 221"
COMP SCI/E C E  252 — INTRODUCTION TO COMPUTER ENGINEERING,"Logic components built with transistors, rudimentary Boolean algebra, basic combinational logic design, basic synchronous sequential logic design, basic computer organization and design, introductory machine- and assembly-language programming.",3 credits.,None
COMP SCI 270 — FUNDAMENTALS OF HUMAN-COMPUTER INTERACTION,"User-centered software design including principles and methods for understanding user needs, designing and prototyping interface solutions, and evaluating their usability covered through lectures and hands-on in-class activities.  Meets with COMP SCI 570.",3 credits.,COMP SCI 570
COMP SCI 272 — INTRODUCTION TO WEB DEVELOPMENT,"Introduces methods and tools for creating/maintaining secure and interactive web content. Topics include programming fundamentals to support core web concepts, application development essentials, and content management systems. Web best practices - such as accessibility, design, and critical thinking about relevant ethics and organization. Covers practical skills to design and implement websites using popular scripting languages and frameworks, content management systems (CMSs), and related tools.",3 credits.,None
COMP SCI 298 — DIRECTED STUDY IN COMPUTER SCIENCE,Undergraduate directed study in computer sciences.,1-3 credits.,None
COMP SCI 300 — PROGRAMMING II,"Introduction to Object-Oriented Programming using classes and objects to solve more complex problems. Introduces array-based and linked data structures: including lists, stacks, and queues. Programming assignments require writing and developing multi-class (file) programs using interfaces, generics, and exception handling to solve challenging real world problems. Topics reviewed include reading/writing data and objects from/to files and exception handling, and command line arguments. Topics introduced: object-oriented design; class vs. object; create and define interfaces and iterators; searching and sorting; abstract data types (List,Stack,Queue,PriorityQueue(Heap),Binary Search Tree); generic interfaces (parametric polymorphism); how to design and write test methods and classes; array based vs. linked node implementations; introduction to complexity analysis; recursion.",3 credits.,"COMP SCI 200, COMP SCI 300, ECE 203, COMP SCI 367"
COMP SCI 304 — WES-CS GROUP MEETING,"Small group meetings for Wisconsin Emerging Scholars - Computer Science (WES-CS) students. Meets in small groups to work together on problems related to the COMP SCI 200 course material. For information about WES-CS membership, contact the computer sciences department.",0-1 credits.,COMP SCI 200
COMP SCI 310 — PROBLEM SOLVING USING COMPUTERS,"Gives students an introduction to computer and analytical skills to use in their subsequent course work and professional development. Discusses several methods of using computers to solve problems, including elementary programming techniques, symbolic manipulation languages, and software packages. Techniques will be illustrated using sample problems drawn from elementary engineering. Emphasis is on introduction of algorithms with the use of specific tools to illustrate the methods.",3 credits.,MATH 222
COMP SCI 319 — DATA SCIENCE PROGRAMMING I FOR RESEARCH,"Introduction to Data Science programming using Python. In addition to a survey of programming basics (control flow and data structures), web scraping, database queries, and tabular analysis will be introduced. Projects will emphasize analyzing real datasets in a variety of forms and visual communication using plotting tools. Similar to COMP SCI 220 but the pedagogical style of the projects will be adapted to graduate students in fields other than computer science and data science. No previous programming experience required.",3 credits.,None
COMP SCI 320 — DATA SCIENCE PROGRAMMING II,"Intermediate approach to Data Science programming using Python. Experience with basic tabular analysis in Python is assumed. Learn to implement data structures (e.g., graphs) to efficiently represent datasets. Software-engineering tools such as version control and Python virtual environments will be introduced, with an emphasis on reproducibility of analysis. Tracing and A/B testing will be introduced as techniques for generating meaningful datasets. Introduces basic classification, clustering, optimization, and simulation techniques. Plotting and visual communication will be emphasized throughout the course.",4 credits.,"COMP SCI 220, COMP SCI 301, COMP SCI 300"
COMP SCI/E C E  352 — DIGITAL SYSTEM FUNDAMENTALS,"Logic components, Boolean algebra, combinational logic analysis and synthesis, synchronous and asynchronous sequential logic analysis and design, digital subsystems, computer organization and design.",3 credits.,None
COMP SCI/E C E  354 — MACHINE ORGANIZATION AND PROGRAMMING,"An introduction to fundamental structures of computer systems and the C programming language with a focus on the low-level interrelationships and impacts on performance. Topics include the virtual address space and virtual memory, the heap and dynamic memory management, the memory hierarchy and caching, assembly language and the stack, communication and interrupts/signals, compiling and assemblers/linkers.",3 credits.,"COMP SCI 300 or COMP SCI 302"
COMP SCI 368 — LEARNING A PROGRAMMING LANGUAGE,"For students interested in learning a particular programming language. Focuses on a specific language offered at one of three levels: beginner, intermediate, and advanced. Students may repeat the course if the topic title is different.",1 credit.,None
COMP SCI 400 — PROGRAMMING III,"The third course in our programming fundamentals sequence. It presumes that students understand and use functional and object-oriented design and abstract data types as needed. This course introduces balanced search trees, graphs, graph traversal algorithms, hash tables and sets, and complexity analysis and about classes of problems that require each data type. Students are required to design and implement using high quality professional code, a medium sized program, that demonstrates knowledge and use of latest language features, tools, and conventions. Additional topics introduced will include as needed for projects: inheritance and polymorphism; anonymous inner classes, lambda functions, performance analysis to discover and optimize critical code blocks. Students learn about industry standards for code development. Students will design and implement a medium size project with a more advanced user-interface design, such as a web or mobile application with a GUI and event- driven implementation; use of version-control software.",3 credits.,COMP SCI 300
COMP SCI 402 — INTRODUCING COMPUTER SCIENCE TO K-12 STUDENTS,Work in teams to lead Computer Science clubs and workshops for K-12 students at sites in the Madison area. Design and lead activities to help K-12 students learn computational thinking and computer programming.,2 credits.,"COMP SCI 200, COMP SCI 300, COMP SCI 202"
COMP SCI/STAT  403 — INTERNSHIP COURSE IN COMP SCI AND DATA SCIENCE,Enables students with outside internships to earn academic credit connected to their work experience related to the Computer Sciences or Data Science programs.,1 credit.,None
COMP SCI 407 — FOUNDATIONS OF MOBILE SYSTEMS AND APPLICATIONS,"Design and implementation of applications, systems, and services for mobile platforms with (i) constraints, such as limited processing, memory, energy, interfaces, variable bandwidth, and high mobility, and (ii) features, such as touchscreens, cameras, electronic compasses, GPS, and accelerometers.",3 credits., COMP SCI 400
COMP SCI 412 — INTRODUCTION TO NUMERICAL METHODS,"Interpolation, solution of linear and nonlinear systems of equations, approximate integration and differentiation, numerical solution of ordinary differential equations, Data fitting (such as least squares) by polynomials and splines. Knowledge of matrix algebra recommended, such as MATH 340.",3 credits.,"MATH 222, MATH 234, COMP SCI 200, COMP SCI 300"
COMP SCI/I SY E/MATH  425 — INTRODUCTION TO COMBINATORIAL OPTIMIZATION,"Focuses on optimization problems over discrete structures, such as shortest paths, spanning trees, flows, matchings, and the traveling salesman problem. We will investigate structural properties of these problems, and we will study both exact methods for their solution, and approximation algorithms.",3 credits.,"MATH 320 or MATH 375"
COMP SCI/E C E/MATH  435 — INTRODUCTION TO CRYPTOGRAPHY,Cryptography is the art and science of transmitting digital information in a secure manner. Provides an introduction to its technical aspects.,3 credits.,"MATH 320 or MATH 375"
COMP SCI/STAT  471 — INTRODUCTION TO COMPUTATIONAL STATISTICS,"Classical statistical procedures arise where closed-form mathematical expressions are available for various inference summaries (e.g. linear regression; analysis of variance). A major emphasis of modern statistics is the development of inference principles in cases where both more complex data structures are involved and where more elaborate computations are required. Topics from numerical linear algebra, optimization, Monte Carlo (including Markov chain Monte Carlo), and graph theory are developed, especially as they relate to statistical inference (e.g., bootstrapping, permutation, Bayesian inference, EM algorithm, multivariate analysis).",3 credits.,"STAT 333 or STAT 340"
COMP SCI/L I S  472 — INTRODUCTION TO WEB DEVELOPMENT,"Applied web development introduces methods and tools for creating/maintaining secure and interactive web content. Topics include programming fundamentals to support core web concepts, application development essentials, and content management systems. Web best practices - such as accessibility, design, and critical thinking about relevant ethics and organization - will be incorporated throughout. Gain practical skills to design and implement websites using popular scripting languages and frameworks, content management systems (CMSs), and related tools.",3 credits.,COMP SCI 272
COMP SCI/MATH/STAT  475 — INTRODUCTION TO COMBINATORICS,"Problems of enumeration, distribution, and arrangement. Inclusion-exclusion principle. Generating functions and linear recurrence relations. Combinatorial identities. Graph coloring problems. Finite designs. Systems of distinct representatives and matching problems in graphs. Potential applications in the social, biological, and physical sciences. Puzzles. Problem solving.",3 credits.,"MATH 320 or MATH 375"
COMP SCI/CURRIC  502 — THEORY AND PRACTICE IN COMPUTER SCIENCE EDUCATION,Computer science educational pedagogy and general teaching practices. Practical experience gained through tutoring students. Knowledge of object-oriented programming required.,1 credit.,"COMP SCI 300, COMP SCI 302"
COMP SCI/E C E  506 — SOFTWARE ENGINEERING,"Ideas and techniques for designing, developing, and modifying large software systems. Topics include software engineering processes; requirements and specifications; project team organization and management; software architectures; design patterns; testing and debugging; and cost and quality metrics and estimation. Students will work in large teams on a substantial programming project.",3 credits.,"COMP SCI 367 or COMP SCI 400, COMP SCI 407"
COMP SCI/MATH  513 — NUMERICAL LINEAR ALGEBRA,"Direct and iterative solution of linear and nonlinear systems and of eigenproblems. LU and symmetric LU factorization. Complexity, stability, and conditioning. Nonlinear systems. Iterative methods for linear systems. QR-factorization and least squares. Eigenproblems: local and global methods.",3 credits.,"MATH 340 or MATH 375, COMP SCI 200, COMP SCI 300"
COMP SCI/MATH  514 — NUMERICAL ANALYSIS,"Polynomial forms, divided differences. Polynomial interpolation. Polynomial approximation: uniform approximation and Chebyshev polynomials, least-squares approximation and orthogonal polynomials. Numerical differentiation and integration. Splines, B-splines and spline approximation. Numerical methods for solving initial and boundary value problems for ordinary differential equations.",3 credits.,"MATH 320 or MATH 375, MATH 322 or MATH 521, COMP SCI 200 or COMP SCI 301, COMP SCI 300"
COMP SCI/DS/I SY E  518 — WEARABLE TECHNOLOGY,"Gives students hands-on experience in building wearable computing platforms. Designed for students who have a background in textiles and apparel design, computer science, engineering or media arts. By the completion of the course students will have fundamental knowledge of electronic circuitry, programming, and ""maker skills"".",3 credits.,None
COMP SCI 520 — INTRODUCTION TO THEORY OF COMPUTING,"Basics about the notion, capabilities, and limitations of computation: elements of finite automata and regular languages, computability theory, and computational complexity theory. Additional topics include context-free grammars and languages, and complexity-theoretic cryptography.",3 credits.,"COMP SCI 367 or COMP SCI 400"
COMP SCI/E C E/I SY E  524 — INTRODUCTION TO OPTIMIZATION,"Introduction to mathematical optimization from a modeling and solution perspective. Formulation of applications as discrete and continuous optimization problems and equilibrium models. Survey and appropriate usage of basic algorithms, data and software tools, including modeling languages and subroutine libraries.",3 credits.,"COMP SCI 200, COMP SCI 300, MATH 320 or MATH 375"
COMP SCI/I SY E/MATH/STAT  525 — LINEAR OPTIMIZATION,"Introduces optimization problems whose constraints are expressed by linear inequalities. Develops geometric and algebraic insights into the structure of the problem, with an emphasis on formal proofs. Presents the theory behind the simplex method, the main algorithm used to solve linear optimization problems. Explores duality theory and theorems of the alternatives.",3 credits.,"MATH 320 or MATH 443"
COMP SCI/I SY E  526 — ADVANCED LINEAR PROGRAMMING,Review of linear programming. Polynomial time methods for linear programming. Quadratic programs and linear complementarity problems and related solution techniques. Solution sets and their continuity properties. Error bounds for linear inequalities and programs. Parallel algorithms for linear and quadratic programs.,3 credits.,"COMP SCI 200, COMP SCI 300"
COMP SCI/E C E/M E  532 — MATRIX METHODS IN MACHINE LEARNING,"Linear algebraic foundations of machine learning featuring real-world applications of matrix methods from classification and clustering to denoising and data analysis. Mathematical topics include: linear equations, regression, regularization, the singular value decomposition, and iterative algorithms. Machine learning topics include: the lasso, support vector machines, kernel methods, clustering, dictionary learning, neural networks, and deep learning. Previous exposure to numerical computing (e.g. Matlab, Python, Julia, R) required.",3 credits.,"MATH 234, or 375, ECE 203, COMP SCI 200, COMP SCI 300"
COMP SCI/E C E  533 — IMAGE PROCESSING,"Mathematical representation of continuous and digital images; models of image degradation; picture enhancement, restoration, segmentation, and coding; pattern recognition, tomography.",3 credits.,"ECE 330, MATH 320 or MATH 340"
COMP SCI 534 — COMPUTATIONAL PHOTOGRAPHY,"Study of sensing and computational techniques that enhance or extend the capabilities of digital photography by using methods from computer vision and computer graphics to create new visual representations. Algorithms for analyzing, improving, manipulating, combining, and synthesizing images.",3 credits.,"COMP SCI 300 or COMP SCI 367, MATH 217 or MATH 221"
COMP SCI 536 — INTRODUCTION TO PROGRAMMING LANGUAGES AND COMPILERS,Introduction to the theory and practice of compiler design. Comparison of features of several programming languages and their implications for implementation techniques. Several programming projects required.,3 credits.,"COMP SCI 367 or COMP SCI 400"
COMP SCI 537 — INTRODUCTION TO OPERATING SYSTEMS,"Input-output hardware, interrupt handling, properties of magnetic tapes, discs and drums, associative memories and virtual address translation techniques. Batch processing, time sharing and real-time systems, scheduling resource allocation, modular software systems, performance measurement and system evaluation.",4 credits.,"COMP SCI 367 or COMP SCI 400"
COMP SCI 538 — INTRODUCTION TO THE THEORY AND DESIGN OF PROGRAMMING LANGUAGES,"Design and theory of programming languages: procedural, object-oriented, functional and logic paradigms. Serial and concurrent programming. Execution models and formal specification techniques.",3 credits.,"COMP SCI 367 or COMP SCI 400"
COMP SCI/E C E/M E  539 — INTRODUCTION TO ARTIFICIAL NEURAL NETWORKS,"Theory and applications of artificial neural networks: multi-layer perceptron, self-organization mapdeep neural network convolutional neural network, recurrent network, support vector machines genetic algorithm, and evolution computing. Applications to control, pattern recognition, prediction, and object detection and tracking.",3 credits.,"COMP SCI 200, COMP SCI 300"
COMP SCI 540 — INTRODUCTION TO ARTIFICIAL INTELLIGENCE,"Principles of knowledge-based search techniques, automatic deduction, knowledge representation using predicate logic, machine learning, probabilistic reasoning. Applications in tasks such as problem solving, data mining, game playing, natural language understanding, computer vision, speech recognition, and robotics.",3 credits.,"COMP SCI 300 or COMP SCI 367, MATH 211, or 275"
COMP SCI 541 — THEORY & ALGORITHMS FOR DATA SCIENCE,"Theoretical methods for data science. Topics include: review of probability background, concentration inequalities, geometry of high dimensional random variables, parametric and non-parametric estimation, selected topics from optimization (optimality conditions; deterministic and stochastic gradient descent), PAC learning, sample complexity and algorithms for linear classification and regression, and property/distribution testing. Uses Python programming language.",3 credits.,"COMP SCI 200, STAT 340, MATH 320 or MATH 375, STAT 311, MATH 331, ECE 210"
COMP SCI 542 — INTRODUCTION TO SOFTWARE SECURITY,"Teaches the security considerations that occur during all steps of the software development life cycle: methodologies for designing secure software, programming using secure programming techniques, in-depth vulnerability assessment methodologies, static and dynamic analysis tools for evaluating software security, and system defenses reducing security threats.",3 credits.,"COMP SCI 400 or COMP SCI 320"
COMP SCI 544 — INTRODUCTION TO BIG DATA SYSTEMS,"Deploy and use distributed systems to store and analyze large datasets.  Unstructured and structured approaches to storage will be covered.  Analysis will involve learning new query languages, processing streaming data, and training machine learning models.  Most programming will be done in Python.",3 credits.,COMP SCI 320
COMP SCI/E C E  552 — INTRODUCTION TO COMPUTER ARCHITECTURE,"The design of computer systems and components. Processor design, instruction set design, and addressing; control structures and microprogramming; memory management, caches, and memory hierarchies; and interrupts and I/O structures.  E C E 551 or knowledge of Verilog is recommended.",3 credits.,None
COMP SCI/I SY E/M E  558 — INTRODUCTION TO COMPUTATIONAL GEOMETRY,"Introduction to fundamental geometric computations and algorithms, and their use for solving engineering and scientific problems. Computer representations of simple geometric objects and paradigms for algorithm design. Applications from areas of engineering analysis, design and manufacturing, biology, statistics, and other sciences.",3 credits.,"COMP SCI 367 or COMP SCI 400, MATH 234"
COMP SCI 559 — COMPUTER GRAPHICS,"Survey of computer graphics. Image representation, formation, presentation, composition and manipulation. Modeling, transformation, and display of geometric objects in two and three dimensions. Representation of curves and surfaces. Rendering, animation, multi-media and visualization. Fluency with vector mathematics (e.g., from MATH 234 or a linear algebra class) is recommended.",3 credits.,"MATH 222, COMP SCI 367 or COMP SCI 400"
COMP SCI/E C E  561 — PROBABILITY AND INFORMATION THEORY IN MACHINE LEARNING,"Probabilistic tools for machine learning and analysis of real-world datasets. Introductory topics include classification, regression, probability theory, decision theory and quantifying information with entropy, relative entropy and mutual information. Additional topics include naive Bayes, probabilistic graphical models, discriminant analysis, logistic regression, expectation maximization, source coding and variational inference.",3 credits.,"MATH 320, ECE 331, STAT 311, MATH 531"
COMP SCI 564 — DATABASE MANAGEMENT SYSTEMS: DESIGN AND IMPLEMENTATION,"What a database management system is; different data models currently used to structure the logical view of the database: relational, hierarchical, and network. Hands-on experience with relational and network-based database systems. Implementation techniques for database systems. File organization, query processing, concurrency control, rollback and recovery, integrity and consistency, and view implementation.",4 credits.,"COMP SCI 367 or COMP SCI 400"
COMP SCI 565 — INTRODUCTION TO DATA VISUALIZATION,"Introduction to topics such as perception, cognition, communication, design, implementation, applications, tools, and evaluation. Provides a broad survey of the field  and covers fundamental concepts, theory, and tools in data visualization with opportunities for hands-on activities. Gain real-world experience in designing and evaluating visualizations.",3 credits., COMP SCI 320
COMP SCI 566 — INTRODUCTION TO COMPUTER VISION,"Topics include image formation, feature detection, motion estimation, image mosaics, 3D shape reconstruction, and object recognition. Applications of these techniques include building 3D maps, creating virtual characters, organizing photo and video databases, human computer interaction, video surveillance, and automatic vehicle navigation. Broad overview of various computer vision and machine learning techniques and sensing and imaging technologies used in computer vision applications. This is a project-based course.",3 credits.,"COMP SCI 400, MATH 320 or MATH 375, STAT 302, MATH 331 or MATH 531"
COMP SCI/B M I  567 — MEDICAL IMAGE ANALYSIS,"Present introductory medical image processing and analysis techniques. Topics include medical imaging formats, segmentation, registration, image quantification, classification.  Strongly encourage Matlab experience, such as COMP SCI 310 or 368-Matlab.",3 credits.,"MATH 320 or MATH 340, STAT 511, STAT 324"
COMP SCI 570 — INTRODUCTION TO HUMAN-COMPUTER INTERACTION,"User-centered software design: (1) principles of and methods for understanding user needs; designing and prototyping interface solutions; and evaluating their usability, (2) their applications in designing multiple types of interfaces through group projects.",3 credits.,None
