Title,Description,Credits,Prerequisites
COMP SCI 571 — BUILDING USER INTERFACES,"Introduces software development of user interfaces (UIs).  Build competence in implementing UIs using state-of-the-art (1) UI paradigms, such as event-driven interfaces, direct-manipulation interfaces, and dialogue-based interaction; (2) methods for capturing, interpreting, and responding to different forms of user input and states, including pointing, text entry, speech, touch, gestures, user activity, context, and physiological states; and (3) platform-specific UI development APIs, frameworks, and toolkits for multiple platforms including web/mobile/desktop interfaces, natural user interfaces, and voice user interfaces. Learn about the fundamental concepts, technologies, algorithms, and methods in building user interfaces, implement UIs using of state-of-the-art UI development tools, and build a UI development portfolio.",3 credits., COMP SCI 400
COMP SCI/B M I  576 — INTRODUCTION TO BIOINFORMATICS,"Algorithms for computational problems in molecular biology. Studies algorithms for problems such as: genome sequencing and mapping, pairwise and multiple sequence alignment, modeling sequence classes and features, phylogenetic tree construction, and gene-expression data analysis.",3 credits.,"COMP SCI 320 or COMP SCI 400, MATH 222"
COMP SCI 577 — INTRODUCTION TO ALGORITHMS,"Basic paradigms for the design and analysis of efficient algorithms: greed, divide-and-conquer, dynamic programming, reductions, and the use of randomness. Computational intractability including typical NP-complete problems and ways to deal with them.",4 credits.,"COMP SCI 367 or COMP SCI 400"
COMP SCI 578 — CONTEST-LEVEL PROGRAMMING,"Training in computer programming for competitions: assessing the coding difficulty and complexity of computational problems, recognizing the applicability of known algorithms, fast coding and testing, team work. COMP SCI 577 is suggested but not required.",1 credit.,"COMP SCI 300 or COMP SCI 367"
COMP SCI/DS  579 — VIRTUAL REALITY,"Introduces students to the field of virtual reality and focuses on creating immersive, interactive virtual experiences. Survey topics include historical perspectives on virtual reality technology, computer graphics and 3D modeling, human perception and psychology, human computer interaction and user interface design. This course is designed for students with backgrounds in Computer Science, Engineering, Art, Architecture and Design. Students will work in interdisciplinary teams on projects, culminating in a final event that will be showcased to the public. While not an official uisite, the class will be technologically motivated; therefore students should be comfortable learning new software. The class will utilize publicly available game design software which provides tools and services for the creation of interactive content. While not necessary, students may find it helpful to have taken classes in programming and computer graphics (such COMP SCI 559: Computer Graphics) or in 3D modeling (such as ART 429: 3D Digital Studio I or DS 242: Visual Communication II).",3 credits.,None
COMP SCI/L I S  611 — USER EXPERIENCE DESIGN 1,"Introduction to the user experience design including key stages of the design process, design ethics, and the methods and tools involved at each stage of design.  Conduct formative research on clients, users, use contexts and tasks. Gain experience with user research methodologies and learn to create intermediate design tools such as personas. Develop and present a design proposal for a chosen project.",3 credits.,None
COMP SCI/L I S  612 — USER EXPERIENCE DESIGN 2,"Advanced study of UX design. Introduces processes of ideation, key concepts of visual design, conceptual and interaction design, low and high-resolution prototyping of design techniques. Applications include drafting designs based on user models and initial testing of prototypes.",3 credits.,None
COMP SCI/L I S  613 — USER EXPERIENCE DESIGN 3,"Conduct formal evaluations of the user experience (UX) or usability of a digital system. Gain familiarity with the evaluation and research process including key stages, tasks for each stage, common data collection and analysis methods, and common tools employed in the field. Gain experience with a variety of UX evaluation approaches. Collect pilot data and develop a proposal for further UX testing.",3 credits.,None
COMP SCI/L I S  614 — USER EXPERIENCE DESIGN CAPSTONE,"Applies a design studio critique approach to produce a learning environment of collaborative and interdisciplinary peer critique and learning, in addition to provide expert feedback and suggestions. Present and defend the latest iteration of the user experience design project developed in earlier courses while learning about the professions associated with digital user experience design.",1 credit.,None
COMP SCI 620 — COMPUTER SCIENCES CAPSTONE,"Build a meaningful product from start to finish with a local, regional, national and international corporate client that solves a real-world problem. In a collaborative space design, develop, test, debug, document, and deliver a software project for a corporate client, learning and using new technologies and agile software development techniques.",3 credits., COMP SCI 400
COMP SCI/I SY E  635 — TOOLS AND ENVIRONMENTS FOR OPTIMIZATION,"Formulation and modeling of applications from computer sciences, operations research, business, science and engineering involving optimization and equilibrium models. Survey and appropriate usage of software tools for solving such problems, including modeling language use, automatic differentiation, subroutine libraries and web-based optimization tools and environments.",3 credits.,"MATH 320, or 375, SCI 200, SCI 300, SCI 202, Fall 2023"
COMP SCI 638 — UNDERGRADUATE TOPICS IN COMPUTING,Selected topics in computing. Each offering of the course will cover a topic selected by the instructor and may cover one or more topics from all of computer science.,1-4 credits.,"COMP SCI 200, COMP SCI 300, COMP SCI 202, Fall 2023"
COMP SCI 639 — UNDERGRADUATE ELECTIVE TOPICS IN COMPUTING,Selected topics in computing. Each offering of the course will cover a topic selected by the instructor. Offerings of this course will provide sufficient depth into their subject to count as electives to meet CS Major requirements.,3-4 credits.,None
COMP SCI 640 — INTRODUCTION TO COMPUTER NETWORKS,"Architecture of computer networks and network protocols, protocol layering, reliable transmission, congestion control, flow control, naming and addressing, unicast and multicast routing, network security, network performance widely used protocols such as Ethernet, wireless LANs, IP, TCP, and HTTP.",3 credits.,COMP SCI 537
COMP SCI 642 — INTRODUCTION TO INFORMATION SECURITY,"Senior level undergraduate course covering various topics on information security. Covers a wide range of topics, such as cryptographic primitives, security protocols, system security, and emerging topics.  Elementary knowledge of mathematical logic and discrete probability theory needed, such as MATH/COMP COMP SCI  240.",3 credits., COMP SCI 537
COMP SCI 681 — SENIOR HONORS THESIS,Individual study for seniors completing theses for honors in the Computer Sciences major as arranged with a faculty member.,3 credits.,None
COMP SCI 682 — SENIOR HONORS THESIS,Individual study for seniors completing theses for honors in the Computer Sciences major as arranged with a faculty member. Continuation of COMP SCI 681,3 credits.,None
COMP SCI 691 — SENIOR THESIS,Individual study for seniors completing theses as arranged with a faculty member.,2-3 credits.,None
COMP SCI 692 — SENIOR THESIS,"Individual study for seniors completing theses as arranged with a faculty member, continuation of COMP SCI 691",2-3 credits.,None
COMP SCI 698 — DIRECTED STUDY,Directed study projects for juniors and seniors as arranged with a faculty member.,1-6 credits.,None
COMP SCI 699 — DIRECTED STUDY,Directed study projects for juniors and seniors as arranged with a faculty member.,1-6 credits.,None
COMP SCI 701 — CONSTRUCTION OF COMPILERS,"Principles of the design and implementation of programming languages. Topics include: Principles of compilation, static program analysis, compilation methods to support profiling, and code-generation methods. Knowledge of programming languages and compiler design strongly encouraged, such as COMP SCI 536.",3 credits.,None
COMP SCI 702 — GRADUATE COOPERATIVE EDUCATION,"A full-time cooperative experience (10 or 5 week option) in computer science in a commercial, government, or nonprofit setting, usually in the form of an internship. The work will be monitored by a graduate advisor from the faculty of the Department of Computer Sciences.  10 week option for 2 credits, 5 week option for 1 credit.",1-2 credits.,None
COMP SCI 703 — PROGRAM VERIFICATION AND SYNTHESIS,"Formal methods for program verification. Model-checking techniques; linear temporal logic; computational tree logic; logic/automata connection; bisimulations; probabilistic model-checking. Special topics include: program synthesis, verification and synthesis of privacy properties. Knowledge of programming languages and compiler design strongly encouraged, such as COMP SCI 536.",3 credits.,None
COMP SCI 704 — PRINCIPLES OF PROGRAMMING LANGUAGES,"Introduction to principles of advanced programming languages and programming-language theory. Topics include: lambda-calculus, functional languages, polymorphic functions, type inference, structural induction, lazy evaluation, operational semantics, denotational semantics, and axiomatic semantics. Students are strongly encouraged to have knowledge of programming languages, such as from COMP SCI 536.",3 credits.,None
COMP SCI 706 — ANALYSIS OF SOFTWARE ARTIFACTS,"Advanced course covering various analysis techniques used in software engineering. Covers techniques for analyzing various software artifacts. Some of the topics that will be covered are: model checking, testing, program analysis, requirements analysis, and safety analysis. Students are strongly encouraged to have knowledge of programming languages and compiler design, such as COMP SCI 536, and a basic knowledge of mathematical logic.",3 credits.,None
COMP SCI/E C E  707 — MOBILE AND WIRELESS NETWORKING,"Design and implementation of protocols, systems, and applications for mobile and wireless networking, particularly at the media access control, network, transport, and application layers. Focus is on the unique problems and challenges presented by the properties of wireless transmission, various device constraints such as limited battery power, and node mobility. Knower of computer networking is strongly encouraged, such as from COMP SCI 640 or E C E 537.",3 credits.,None
COMP SCI 710 — COMPUTATIONAL COMPLEXITY,"Study of the capabilities and limitations of efficient computation. Relationships between models representing capabilities such as parallelism, randomness, quantum effects, and non-uniformity; and models based on the notions of nondeterminism, alternation, and counting, which capture the complexity of important problems.  Knowledge of the theory of computation is strongly encouraged, such as COMP SCI 520.",3 credits.,None
COMP SCI/MATH  714 — METHODS OF COMPUTATIONAL MATHEMATICS I,"Development of finite difference methods for hyperbolic, parabolic and elliptic partial differential equations. Analysis of accuracy and stability of difference schemes. Direct and iterative methods for solving linear systems. Introduction to finite volume methods. Applications from science and engineering. Students are strongly encouraged to have programming skills (e.g. COMP SCI 200) and some undergraduate numerical analysis (e.g. MATH/COMP SCI  514 or COMP SCI 412), analysis and differential equations (e.g. MATH 322 and MATH 521) and linear algebra (e.g. MATH 341).",3 credits.,None
COMP SCI/MATH  715 — METHODS OF COMPUTATIONAL MATHEMATICS II,"Introduction to spectral methods (Fourier, Chebyshev, Fast Fourier Transform), finite element methods (Galerkin methods, energy estimates and error analysis), and mesh-free methods (Monte-Carlo, smoothed-particle hydrodynamics) for solving partial differential equations. Applications from science and engineering. Applications from science and engineering. Students are strongly encouraged to have programming skills (e.g. COMP SCI 200), undergraduate numerical analysis (e.g. MATH/COMP SCI  514 or COMP SCI 412), analysis (MATH 322 and 521) and linear algebra (e.g. MATH 341 or equiv.)",3 credits.,None
COMP SCI/I SY E  719 — STOCHASTIC PROGRAMMING,"Stochastic programming is concerned with decision making in the presence of uncertainty, where the eventual outcome depends on a future random event. Topics include modeling uncertainty in optimization problems, risk measures, stochastic programming algorithms, approximation and sampling methods, and applications.  Students are strongly encouraged to have knowledge of linear programming (e.g., MATH/COMP SCI/I SY E/STAT  525) and probability and statistics (e.g., MATH/STAT  431). Knowledge of integer optimization (MATH/COMP SCI/I SY E  728) is helpful, but not required.",3 credits.,None
COMP SCI/B M I/E C E/MED PHYS  722 — COMPUTATIONAL OPTICS AND IMAGING,"Computational imaging includes all imaging methods that produce images as a result of computation on collected signals. Learn the tools to design new computational imaging methods to solve specific imaging problems. Provides an understanding of the physics of light propagation and measurement, and the computational tools to model it, including wave propagation, ray tracing, the radon transform, and linear algebra using matrix and integral operators and the computational tools to reconstruct an image, including linear inverse problems, neural networks, convex optimization, and filtered back-projection. Covers a variety of example computational imaging techniques and their applications including coded apertures, structured illumination, digital holography, computed tomography, imaging through scattering media, compressed sensing, and non-line-of-sight imaging.",3 credits.,None
COMP SCI/I SY E  723 — DYNAMIC PROGRAMMING AND ASSOCIATED TOPICS,"General and special techniques of dynamic programming developed by means of examples. Shortest-path algorithms. Deterministic equipment replacement models. Resource allocation problem. Traveling-salesman problem. Knapsack problem. Analysis of inventory systems. General stochastic formulations. Markovian decision processes.  Students are strongly encouraged to have knowledge of mathematical optimization (e.g., COMP SCI/I SY E/MATH/STAT  525, I SY E 623, COMP SCI/I SY E/MATH/STAT  726), knowledge of analysis (e.g., MATH/STAT  431 or 521) and programming ability (e.g., COMP SCI 200 or 301)",3 credits.,None
COMP SCI/I SY E/MATH/STAT  726 — NONLINEAR OPTIMIZATION I,"Theory and algorithms for nonlinear optimization, focusing on unconstrained optimization. Line-search and trust-region methods; quasi-Newton methods; conjugate-gradient and limited-memory methods for large-scale problems; derivative-free optimization; algorithms for least-squares problems and nonlinear equations; gradient projection algorithms for bound-constrained problems; and simple penalty methods for nonlinearly constrained optimization. Students are strongly encouraged to have knowledge of linear algebra and familiarity with basic mathematical analysis.",3 credits.,None
COMP SCI/I SY E  727 — CONVEX ANALYSIS,"Convex sets in finite-dimensional spaces: relative interiors, separation, set operations. Convex functions: conjugacy, subdifferentials and directional derivations, functional operations, Fenchel-Rockafellar duality. Applications to operations research and related areas.  Students taking this course are strongly encouraged to have had a course in basic analysis (e.g. MATH 521) and a course in linear algebra (e.g., MATH 340).",3 credits.,None
COMP SCI/I SY E/MATH  728 — INTEGER OPTIMIZATION,"Introduces optimization problems over integers, and surveys the theory behind the algorithms used in state-of-the-art methods for solving such problems. Special attention is given to the polyhedral formulations of these problems, and to their algebraic and geometric properties. Applicability of Integer Optimization is highlighted with applications in combinatorial optimization. Key topics include: formulations, relaxations, polyhedral theory, cutting planes, decomposition, enumeration.  Students are strongly encouraged to have knowledge of Linear Programming  (e.g., MATH/COMP SCI/I SY E/STAT  525), including algorithms, duality and polyhedral theory.",3 credits.,None
COMP SCI/I SY E/MATH  730 — NONLINEAR OPTIMIZATION II,"Theory and algorithms for nonlinearly constrained optimization. Relevant geometric concepts, including tangent and normal cones, theorems of the alternative, and separation results. Constraint qualifications. Geometric and algebraic expression of first-order optimality conditions. Second-order optimality conditions. Duality. Nonlinear  programming algorithms: merit functions and filters; interior-point, augmented Lagrangian, and sequential quadratic programming algorithms.",3 credits.,None
COMP SCI 736 — ADVANCED OPERATING SYSTEMS,"Advanced topics in operating systems, including process communication, resource allocation, multiprocess and network operating systems, kernel philosophies, fault-tolerant systems, virtual machines, high-level language systems, verifiability and proof techniques. Comp Sci 537 or cons inst",3 credits.,None
COMP SCI 739 — DISTRIBUTED SYSTEMS,"Basic concepts; distributed programming; distributed file systems; atomic actions; fault tolerance, transactions, program and data replication, recovery; distributed machine architectures; security and authentication; load balancing and process migration; distributed debugging; distributed performance measurement; distributed simulation techniques; distributed applications; correctness considerations and proof systems.",3 credits.,SCI 736
COMP SCI 740 — ADVANCED COMPUTER NETWORKS,"Advanced topics in computer communications networks: congestion and flow control; routing; rate-based protocols; high speed interfaces and technologies: metropolitan area networks; fast packet switching technologies; advanced applications; network services: name service, authentication, resource location.  Students are strongly encouraged to have knowledge of computer network design and protocols (e.g., COMP SCI 640)",3 credits.,None
COMP SCI 744 — BIG DATA SYSTEMS,"Issues in the design and implementation of big data processing systems, including: an overview of cluster architecture, key design goals (flexibility, performance and fault tolerance), popular execution frameworks, basic abstractions, and applications (e.g., batch analytics, stream processing, graph processing, and machine learning).",3 credits.,None
COMP SCI/E C E  750 — REAL-TIME COMPUTING SYSTEMS,"Introduction to the unique issues in the design and analysis of computer systems for real-time applications. Hardware and software support for guaranteeing timeliness with and without failures. Resource management, time-constrained communication, scheduling and imprecise computations, real-time kernels and case studies.  Students are strongly encouraged to have knowledge of computer architecture (e.g., E C E/COMP SCI  552) and operating system functions (e.g., COMP SCI 537)",3 credits.,None
COMP SCI/E C E  752 — ADVANCED COMPUTER ARCHITECTURE I,"Processor design, computer arithmetic, pipelining, multi-operation processors, vector processors, control units, precise interrupts, main memory, cache memories, instruction set design, stack machines, busses and I/O, protection and security.  Students are strongly encouraged to have knowledge of computer architecture (e.g., E C E/COMP SCI  552).",3 credits.,None
COMP SCI/E C E  755 — VLSI SYSTEMS DESIGN,Overview of MOS devices and circuits; introduction to integrated circuit fabrication; topological design of data flow and control; interactive graphics layout; circuit simulation; system timing; organizational and architectural considerations; alternative implementation approaches; design project. E C E 555 or equivalent experience is strongly recommended.,3 credits.,None
COMP SCI/E C E  756 — COMPUTER-AIDED DESIGN FOR VLSI,"Broad introduction to computer-aided design tools for VLSI, emphasizing implementation algorithms and data structures. Topics covered: design styles, layout editors, symbolic compaction, module generators, placement and routing, automatic synthesis, design-rule checking, circuit extraction, simulation and verification.  Students are strongly encourage to have programming skills and to  have taken a course in Digital System Fundamentals such as E C E/COMP SCI  352.",3 credits.,None
COMP SCI/E C E  757 — ADVANCED COMPUTER ARCHITECTURE II,"Parallel algorithms, principles of parallelism detection and vectorizing compilers, interconnection networks, MIMD machines, processor synchronization, data coherence, multis, dataflow machines, special purpose processors.  Students are strongly encouraged to have knowledge of computer architecture (e.g., E C E/COMP SCI  552).",3 credits.,None
COMP SCI 758 — ADVANCED TOPICS IN COMPUTER ARCHITECTURE,"Advanced topics in computer architecture that explore the implications to architecture of forthcoming evolutionary and revolutionary changes in application demands, software paradigms, and hardware implementation technologies.  Students are strongly encouraged to have knowledge of computer architecture (e.g., E C E/COMP SCI  552).",3 credits.,None
COMP SCI/E C E/E M A/E P/M E  759 — HIGH PERFORMANCE COMPUTING FOR APPLICATIONS IN ENGINEERING,An overview of hardware and software solutions that enable the use of advanced computing in tackling computationally intensive Engineering problems. Hands-on learning promoted through programming assignments that leverage emerging hardware architectures and use parallel computing programming languages. Students are strongly encourage to have completed COMP SCI 367 or COMP SCI 400 or to have equivalent experience.,3 credits.,None
COMP SCI/E C E  760 — MACHINE LEARNING,"Computational approaches to learning: including inductive inference, explanation-based learning, analogical learning, connectionism, and formal models. What it means to learn. Algorithms for learning. Comparison and evaluation of learning algorithms. Cognitive modeling and relevant psychological results.",3 credits.,None
COMP SCI/E C E  761 — MATHEMATICAL FOUNDATIONS OF MACHINE LEARNING,"Mathematical foundations of machine learning theory and algorithms. Probabilistic, algebraic, and geometric models and representations of data, mathematical analysis of state-of-the-art learning algorithms and optimization methods, and applications of machine learning. Knowledge of probability [such as MATH/STAT  431 or COMP SCI/E C E  561] and linear algebra [such as MATH 341 or M E/COMP SCI/ECE  532] is required.",3 credits.,None
COMP SCI 762 — ADVANCED DEEP LEARNING,"Explore methods and applications of deep learning. Covers cutting-edge topics, including neural architecture design, robustness and reliability of deep learning, learning with less supervision, lifelong machine learning, deep generative modeling, theoretical understanding of deep learning, and interpretable deep learning.",3 credits.,None
COMP SCI 763 — SECURITY AND PRIVACY FOR DATA SCIENCE,"Security and privacy concerns in data science. Three core subjects will be considered: Differential privacy and algorithmic fairness; Adversarial machine learning; and Applied cryptography, especially with applications to machine learning. In addition, a selection of more advanced topics will be covered. Possible examples include additional notions of privacy, language-based security, robust optimization. A firm grasp of probability/statistics (STAT/MATH  431) is recommended. Previous exposure to at least one of cryptography (COMP SCI/E C E/MATH  435), security (COMP SCI 642), and modern machine learning (COMP SCI/E C E/M E  539 or 540) is also recommended.",3 credits.,None
COMP SCI 764 — TOPICS IN DATABASE MANAGEMENT SYSTEMS,"Implementation of database management systems, the impact of new technology on database management systems, back-end database computers, distributed database management systems, concurrency control, and query execution in both distributed and centralized systems, implementation of multiple user views, roll-back and recovery mechanisms, database translation. Students are strongly encouraged to have knowledge of database design (e.g., COMP SCI 564).",3 credits.,None
COMP SCI 765 — DATA VISUALIZATION,"Principles of the visual presentation of data. Survey of Information Visualization, Scientific Visualization, and Visual Analytics. Design and evaluation of visualizations and interactive exploration tools. Introduction to relevant foundations in visual design, human perception, and data analysis. Encodings, layout and interaction. Approaches to large data sets. Visualization of complex data types such as scalar fields, graphs, sets, texts, and multi-variate data. Use of 2D, 3D and motion in data presentations. Implementation issues.",3 credits.,None
