Title,Description,Credits,Prerequisites
STAT 698 — DIRECTED STUDY,Directed study projects as arranged with a faculty member.,1-6 credits.,None
STAT 699 — DIRECTED STUDY,Directed study projects as arranged with a faculty member.,1-6 credits.,None
"STAT 701 — APPLIED TIME SERIES ANALYSIS, FORECASTING AND CONTROL I","Theory and application of discrete time series models illustrated with forecasting problems. Principles of iterative model building. Representation of dynamic relations by difference equations. Autoregressive integrated Moving Average models. Identification, fitting, diagnostic checking of models. Seasonal model application to forecasting in business, economics, ecology, and engineering used at each stage, which the student analyzes using computer programs which have been specially written and extensively tested.",3 credits.,None
STAT/MATH  709 — MATHEMATICAL STATISTICS,"Introduction to measure theoretic probability; derivation and transformation of probability distributions; generating functions and characteristic functions; conditional expectation, sufficiency, and unbiased estimation; methods of large sample theory including laws of large numbers and central limit theorems; order statistics.",4 credits.,None
STAT/MATH  710 — MATHEMATICAL STATISTICS,"Estimation, efficiency, Neyman-Pearson theory of hypothesis testing, confidence regions, decision theory, analysis of variance, and distribution of quadratic forms.",4 credits.,None
STAT/COMP SCI/I SY E/MATH  726 — NONLINEAR OPTIMIZATION I,"Theory and algorithms for nonlinear optimization, focusing on unconstrained optimization. Line-search and trust-region methods; quasi-Newton methods; conjugate-gradient and limited-memory methods for large-scale problems; derivative-free optimization; algorithms for least-squares problems and nonlinear equations; gradient projection algorithms for bound-constrained problems; and simple penalty methods for nonlinearly constrained optimization. Students are strongly encouraged to have knowledge of linear algebra and familiarity with basic mathematical analysis.",3 credits.,None
STAT/B M I  727 — THEORY AND METHODS OF LONGITUDINAL DATA ANALYSIS,"Theory and methods of fundamental statistical models for the analysis of longitudinal data, including repeated measures analysis of variance, linear mixed models, generalized linear mixed models, and generalized estimating equations. Introduction of how to implement these methods in statistical softwares such as in R and/or SAS, within the context of appropriate statistical models and carry out and interpret analyses.",3 credits.,STAT 610
STAT 732 — LARGE SAMPLE THEORY OF STATISTICAL INFERENCE,Stochastic modes of convergence. Asymptotic theory of normed sums of random variables with applications to asymptotic normality of estimators. Methods for deriving limit distributions of nonlinear statistics. Asymptotic relative efficiencies. Asymptotic confidence regions and tests of hypotheses. Models of non-identically distributed or dependent random variables.,3 credits.,STAT 610
STAT/MATH  733 — THEORY OF PROBABILITY I,"An introduction to measure theoretic probability and stochastic processes.Topics include foundations, independence, zero-one laws, laws of large numbers, convergence in distribution, characteristic functions, central limit theorems, random walks, conditional expectations. Familiarity with basic measure theory (e.g. MATH 629 or 721) or concurrent registration in MATH 721 is strongly recommended.",3 credits.,None
STAT/MATH  734 — THEORY OF PROBABILITY II,"Possible topics include martingales, weak convergence of measures, introduction to Brownian motion.",3 credits.,None
STAT/B M I  741 — SURVIVAL ANALYSIS THEORY AND METHODS,"Theory and practice of analytic methods for censored survival data, including nonparametric and parametric methods, the proportional hazards regression model, and a review of current topics in survival analysis.",3 credits.,None
STAT 760 — MULTIVARIATE ANALYSIS I,"Multivariate normal distribution, estimation of mean and covariance matrix; Wishart distribution; distribution of partial and multiple correlation coefficients; Hotelling's T-squared, principal components.",3 credits.,STAT 610
STAT 761 — DECISION TREES FOR MULTIVARIATE ANALYSIS,"Tree construction, including finding splits, tree-pruning and error estimation. Categorical predictor variables, missing or censored data, prior class-probabilities, and unequal misclassification costs. Selection bias. Comparison with other statistics and machine-learning methods. Extensions to piecewise linear and non-least squares regression models.",3 credits.,None
STAT/B M I  768 — STATISTICAL METHODS FOR MEDICAL IMAGE ANALYSIS,Introduce key statistical methods and concepts for analyzing various medical images. Analyze publicly available and student/instructor supplied imaging data using the most up-to-date methods and tools.,3 credits.,None
STAT 771 — STATISTICAL COMPUTING,"The design of statistical software including special techniques for probability distributions, methods of simulation of random processes, numerical methods for linear models and multivariate analysis, and methods for nonlinear models.",3 credits.,None
STAT 772 — LINEAR RANDOMIZED ALGORITHMS FOR DATA SCIENCE,"Introduce new algorithms that leverage randomization to address the scale, speed, and sensitivity needs of modern data science. Develop the mathematical foundations of such randomized algorithms. Criticize these algorithms through the lens of computational resource utilization. Implement these algorithms to address linear problems in data science.",3 credits.,None
STAT/ECON/GEN BUS  775 — BAYESIAN STATISTICS,"Introduces the theory, methods, and computational procedures needed to perform advanced Bayesian data analyses. Predictive and decision-theoretic motivations including subjective probability, risk, admissibility, and exchangeability; highlights key components of Bayesian analysis (i.e., prior, likelihood, posterior, and predictive distributions) within standard parametric models and advanced hierarchical and multilevel models; demonstrates the iterative process of model specification, implementation, criticism, and revision with applied case studies; implements computational techniques (e.g., Markov chain Monte Carlo, variational inference) in modern probabilistic programming languages.",3 credits.,"STAT 609, ECON 709, SCI 818"
STAT 780 — INTRODUCTION TO QUANTUM DATA SCIENCE,"Quantum computation issues, including probability, statistics, sensing, information, machine learning, and applying data science to quantum information science.",3 credits.,"STAT 601, STAT 609, and STAT 610, STAT 611, and 612"
STAT 801 — ADVANCED FINANCIAL STATISTICS,"Statistical theory and methodology for modern financial data. Topics include financial stochastic models based on time series and stochastic calculus, modern statistical inference, and statistical learning for financial data as well as their applications to financial problems.",3 credits.,"STAT 601, STAT 701"
STAT/MATH  803 — EXPERIMENTAL DESIGN I,"Summary of matrix algebra required, theory of estimable functions, incomplete blocks, balanced incomplete block designs, partially balanced incomplete block designs.",3 credits.,None
STAT 809 — NON PARAMETRIC STATISTICS,"Statistical procedures valid under unrestrictive assumptions; sign test; confidence intervals; efficiency comparisons; signed rank procedures; Walsh sums; point estimators; two sample rank tests; zeros, ties, and other problems of discrete data; order statistics; Winsorized and truncated point estimators and connection with gross error models; permutation procedures; combinatorial problems, and computer applications.",3 credits.,STAT 610
STAT 811 — SAMPLE SURVEY THEORY AND METHOD,Simple random sampling; systematic sampling; probability sampling; stratified sampling; subsampling with units of equal and unequal size; double sampling; multi-stage and multi-phase sampling; ratio and regression estimates; model-based and model-assisted approaches; variance estimation; non-response.,3 credits.,STAT 610
STAT/B M I  828 — SEMIPARAMETRIC METHODS IN DATA SCIENCE,"Review of statistical convergence modes, M-estimation, and basics of Hilbert space. Introduction of how to derive the nuisance tangent space, its complement, and the corresponding efficient influence function, from the geometric perspective of semiparametric models. Introduction of how to estimate nuisance functions using machine learning methods, and their implementations in R and/or Python. Introduction of a variety of semiparametric models in missing data analysis, causal inference, dimension reduction, precision medicine, semi-supervised learning, transfer learning and domain adaptation.",3 credits.,None
STAT/MATH  833 — TOPICS IN THE THEORY OF PROBABILITY,Advanced topics in probability and stochastic processes.,3 credits.,None
STAT 834 — EMPIRICAL PROCESSES AND SEMIPARAMETRIC INFERENCE,Empirical process methods in statistics; semiparametric models; stochastic convergence in metric spaces; Glivenko-Cantelli and Donsker theorems; entropy calculations; bootstrapped empirical processes; functional delta method; Z-estimators; M-estimators; rates of convergence; semiparametric efficiency; semiparametric estimating equations; nonparametric maximum likelihood.,1-3 credits.,STAT 610
STAT 840 — STATISTICAL MODEL BUILDING AND LEARNING,Theory of reproducing kernel Hilbert spaces in statistical model building; bounded linear functionals and representer theory; smoothing splines; ANOVA spines; degees of freedom for signal and the bias-variance tradeoff; Bayesian confidence intervals; model selection.,3 credits.,STAT 610
STAT 841 — NONPARAMETRIC STATISTICS AND MACHINE LEARNING METHODS,"Statistical function estimation and classification; reproducing kernel machines, support vector machines; high dimensional model selection and estimation; Bayesian, empirical Bayesian interpretation of nonparametric learning methods; log density ANOVA and graphical models; tree ensemble methods including bagging, boosting, and random forest.",3 credits.,STAT 610
STAT 849 — THEORY AND APPLICATION OF REGRESSION AND ANALYSIS OF VARIANCE I,"Theory and applications of the general linear model; graphical methods; simultaneous inference; regression diagnostics; analysis of variance of fixed, random and mixed effects models; ANCOVA: violations of assumptions.",3 credits.,None
STAT 850 — THEORY AND APPLICATION OF REGRESSION AND ANALYSIS OF VARIANCE II,"Theory and applications of the general linear model; graphical methods; simultaneous inference; regression diagnostics; analysis of variance of fixed, random and mixed effects models; ANCOVA: violations of assumptions.",3 credits.,STAT 849
STAT 860 — ESTIMATION OF FUNCTIONS FROM DATA,Statistical and appoximation theoretic methods of estimating functions and values of functionals from experimental data; experimental design and data analysis problems that arise as problems in approximation theory; convergence theorems; ill-posed inverse problems; Banach and Hilbert space penalty functionals.,3 credits.,STAT 610
STAT/COMP SCI/E C E  861 — THEORETICAL FOUNDATIONS OF MACHINE LEARNING,"Advanced mathematical theory and methods of machine learning. Statistical learning theory, Vapnik-Chevronenkis Theory, model selection, high-dimensional models, nonparametric methods, probabilistic analysis, optimization, learning paradigms.",3 credits.,E 830
STAT/B M I  877 — STATISTICAL METHODS FOR MOLECULAR BIOLOGY,"Statistical and computational methods in statistical genomics for human and experimental populations. Review methods for quality control, experimental design, clustering, network analysis, and other downstream analysis of next-generation sequencing studies along with methods for genome wide association studies.",3 credits.,None
STAT/E C E/MATH  888 — TOPICS IN MATHEMATICAL DATA SCIENCE,Advanced topics in the mathematical foundations of data science,1-3 credits.,None
STAT 990 — RESEARCH,Independent research and writing for graduate students under the supervision of a faculty member.,1-12 credits.,None
STAT 992 — SEMINAR,Special topics in statistics at the graduate level. Subject matter varies.,1-3 credits.,None
STAT 998 — STATISTICAL CONSULTING,Consulting apprenticeship.,3 credits.,None