Title,Description,Credits,Prerequisites
STAT 240 — DATA SCIENCE MODELING I,"Introduces reproducible data management, modeling, analysis, and statistical inference through a practical, hands-on case studies approach. Topics include the use of an integrated statistical computing environment, data wrangling, the R programming language, data graphics and visualization, random variables and concepts of probability including the binomial and normal distributions, data modeling, statistical inference in one- and two- sample settings for proportions and means, simple linear regression, and report generation using R Markdown with applications to a wide variety of data to address open-ended questions.",4 credits.,None
STAT 301 — INTRODUCTION TO STATISTICAL METHODS,"Distributions, measures of central tendency, dispersion and shape, the normal distribution; experiments to compare means, standard errors, confidence intervals; effects of departure from assumption; method of least squares, regression, correlation, assumptions and limitations; basic ideas of experimental design.",3 credits.,"STAT 302, STAT 371"
STAT 303 — R FOR STATISTICS I,An understanding of the commonly used statistical language R. Topics will include using R to manipulate data and perform exploratory data analysis.,1 credit.,"STAT 240, ECON 310, BUS 303, PSYCH 210, E 325, E 210"
STAT 304 — R FOR STATISTICS II,"Provides an understanding of the commonly used statistical language R. Topics will include writing conditional expressions, loops, and functions; manipulating data matrices and arrays; extracting data from text; and making high level visualizations of data.",1 credit.,STAT 303
STAT 305 — R FOR STATISTICS III,Provides an understanding of the commonly used statistical language R. Learn to combine R with high performance computing tools to do scientific computing.,1 credit.,STAT 304
STAT/MATH  309 — INTRODUCTION TO PROBABILITY AND MATHEMATICAL STATISTICS I,"Probability and combinatorial methods, discrete and continuous, univariate and multivariate distributions, expected values, moments, normal distribution and derived distributions, estimation.",3 credits.,"MATH 234, STAT 311"
STAT/MATH  310 — INTRODUCTION TO PROBABILITY AND MATHEMATICAL STATISTICS II,"Mathematical statistical inference aims at providing an understanding of likelihood's central role to statistical inference, using the language of mathematical statistics to analyze statistical procedures, and using the computer as a tool for understanding statistics. Specific topics include: samples and populations, estimation, hypothesis testing, and theoretical properties of statistical inference.",3 credits.,"STAT 311, MATH 531, STAT 240, STAT 301, STAT 302, STAT 324, STAT 371, ECON 310"
STAT 311 — INTRODUCTION TO THEORY AND METHODS OF MATHEMATICAL STATISTICS I,"Elements of probability, important discrete distributions, acceptance sampling by attributes, sample characteristics, probability distributions and population characteristics, the normal distribution, acceptance sampling plans based on sample means and variances, sampling from the normal, the central limit theorem, point and interval estimation.",3 credits.,MATH 234
STAT 312 — INTRODUCTION TO THEORY AND METHODS OF MATHEMATICAL STATISTICS II,"Unbiased estimation, maximum likelihood estimation, confidence intervals, tests of hypotheses, Neyman-Pearson lemma, likelihood ratio test, regression, analysis of variance with applications.",3 credits.,"STAT 311, MATH 531"
STAT 324 — INTRODUCTORY APPLIED STATISTICS FOR ENGINEERS,"Descriptive statistics, probability concepts and distributions, random variables. Hypothesis tests and confidence intervals for one- and two-sample problems. Linear regression, model checking, and inference. Analysis of variance and basic ideas in experimental design. Utilizes the R programming language.",3 credits.,"MATH 211, MATH 221, STAT 302, STAT 371"
STAT 333 — APPLIED REGRESSION ANALYSIS,"An introduction to regression with emphasis on the practical aspects. Topics include: straight-line model, role of assumptions, residual analysis, transformations, multiple regression (with some use of matrix notation), multicollinearity, subset selection, and a brief introduction to mixed models.",3 credits.,"STAT 240, ECON 310, E 325, E 210, STAT 327, STAT 303"
STAT 340 — DATA SCIENCE MODELING II,"Teaches how to explore, model, and analyze data using R. Topics include basic probability models; the central limit theorem; Monte Carlo simulation; one- and two-sample hypothesis testing; Bayesian inference; linear and logistic regression; ANOVA; the bootstrap; random forests and cross-validation. Features the analysis of real-world data sets and the communication of findings in a clear and reproducible manner within a project setting.",4 credits.,"MATH 211, MATH 221, STAT 240"
STAT 349 — INTRODUCTION TO TIME SERIES,"Autocorrelation; stationarity and non-stationarity; heteroscedasticity; dynamic models; auto-regressive and moving average models; identification and fitting; forecasting; seasonal adjustment; applications for financial time series, social sciences and environmental studies.",3 credits.,STAT 333
STAT 351 — INTRODUCTORY NONPARAMETRIC STATISTICS,"Distribution free statistical procedures or methods valid under nonrestrictive assumptions: basic tools; counting methods; order statistics, ranks, empirical distribution functions; distribution free tests and associated interval and point estimators; sign test; signed rank tests; rank tests; Mann Whitney Wilcoxon procedures; Kolmogorov Smirnov tests; permutation methods; kernel density estimation; kernel and spline regression estimation; computer techniques and programs; discussion and comparison with parametric methods.",3 credits.,STAT 333
STAT 360 — TOPICS IN STATISTICS STUDY ABROAD,Credit is awarded for students having completed an advanced statistics course in a study abroad program for which there is no direct equivalence to the statistics department course offerings. The study abroad course must be pre-approved by the statistics department. Enrollment in a UW-Madison resident study abroad program.,1-3 credits.,None
STAT 371 — INTRODUCTORY APPLIED STATISTICS FOR THE LIFE SCIENCES,"Introduction to modern statistical practice in the life sciences, using the R programming language. Topics include: exploratory data analysis, probability and random variables; one-sample testing and confidence intervals, role of assumptions, sample size determination, two-sample inference; basic ideas in experimental design, analysis of variance, linear regression, goodness-of fit; biological applications.",3 credits.,"MATH 112, MATH 113, MATH 113, MATH 112, MATH 112, and MATH 113, MATH 114, or 221, MATH 221, STAT 302, STAT 324"
STAT/COMP SCI  403 — INTERNSHIP COURSE IN COMP SCI AND DATA SCIENCE,Enables students with outside internships to earn academic credit connected to their work experience related to the Computer Sciences or Data Science programs.,1 credit.,None
STAT 405 — DATA SCIENCE COMPUTING PROJECT,"The development of tools necessary for collecting, managing, and analyzing large data sets. Examples of techniques and programs used include Linux, R, distributed computing, text editor(s), git/github, and other related tools. Work in teams to research, develop, write, and make presentations related to a variety of data analysis projects.",3 credits.,"STAT 240, STAT 303, SCI 200, SCI 300"
STAT 411 — AN INTRODUCTION TO SAMPLE SURVEY THEORY AND METHODS,"An introduction to the methods used to design sample surveys and analyze the results. Topics covered include: basic tools, simple random sampling, ratio and regression estimation, stratification, systematic sampling, cluster (area) sampling, two-stage sampling, unequal probability sampling, non-sampling errors, and missing data. For illustration and clarification, examples are drawn from diverse areas of application.",3 credits.,STAT 333
STAT 421 — APPLIED CATEGORICAL DATA ANALYSIS,"Analysis of multidimensional contingency tables, Poisson regression, and logistic regression, with emphasis on practical applications. Use of computer programs for such analyses. Model selection, testing goodness of fit, estimation of parameters, measures of association and methods for detecting sources of significance.",3 credits.,STAT 333
STAT/M E  424 — STATISTICAL EXPERIMENTAL DESIGN,"Introduction to statistical design and analysis of experiments. Topics include: principles of randomization, blocking and replication, randomized blocking designs, Latin square designs, full factorial and fractional factorial designs and response surface methodology. Substantial focus will be devoted to engineering applications.",3 credits.,STAT 240
STAT/MATH  431 — INTRODUCTION TO THE THEORY OF PROBABILITY,"Topics covered include axioms of probability, random variables, the most important discrete and continuous probability distributions, expectation and variance, moment generating functions, conditional probability and conditional expectations, multivariate distributions, Markov's and Chebyshev's inequalities, laws of large numbers, and the central limit theorem.",3 credits.,"MATH 234, MATH 376"
STAT 433 — DATA SCIENCE WITH R,"Perform Data Science as an iterative (back and forth) process of four different types of activities (data collection, data wrangling, data analysis, communication). Traverse through the five requisite stances (scientist, coder, mathematician, methodologist, skeptic). Develop and hone a broad set of computational tools in R (but not the broadest) and a broad set of statistical/machine learning tools (but not the broadest). Focus on doing these with agility to make the coding ""transparent"" and serve the large goals of the project.",3 credits.,"STAT 333, STAT 340, MATH 320, MATH 375"
STAT 436 — STATISTICAL DATA VISUALIZATION,"Techniques for visualization within data science workflows. Topics include data preparation; exploratory data analysis; spatial, tabular, and graph structured data; dimensionality reduction; model visualization and interpretability; interactive queries and navigation.",3 credits.,"STAT 240, STAT 303"
STAT 443 — CLASSIFICATION AND REGRESSION TREES,"Introduction to algorithms and applications of classification and regression trees. Recursive partitioning, pruning, and cross-validation estimation of prediction error. Class priors and misclassification costs. Univariate and linear splits. Linear and kernel discriminant analysis and nearest-neighbor classification. Unbiased variable selection and importance scoring of variables. Least-squares, quantile, Poisson, logistic, and proportional hazards regression tree models. Tree ensembles. Subgroup identification of differential treatment effects. Multiple and longitudinal response variables. Missing values and multiple missing value codes.  Comparisons with neural networks, support vector machines, and other methods. Bootstrap calibration and post-selection inference. Applications to business, social science, engineering, biology, medicine, and other fields.",3 credits.,STAT 333
STAT 451 — INTRODUCTION TO MACHINE LEARNING AND STATISTICAL PATTERN CLASSIFICATION,"Pattern classification, regression analysis, clustering, and dimensionality reduction. For each category, covers fundamental algorithms and selections of contemporary, current state-of-the-art algorithms. Focus on evaluation of machine learning models using statistical methods. Statistical pattern classification approaches, including maximum likelihood estimation and Bayesian decision theory, algorithmic and nonparametric approaches. Practical use of machine learning algorithms using open source libraries from the Python programming ecosystem.",3 credits.,MATH 320
STAT 453 — INTRODUCTION TO DEEP LEARNING AND GENERATIVE MODELS,"Deep learning is a field that specializes in discovering and extracting intricate structures in large, unstructured datasets for parameterizing artificial neural networks with many layers. Since deep learning has pushed the state-of-the-art in many research and application areas, it's become indispensable for modern technology. Focuses on a understanding deep, artificial neural networks by connecting it to related concepts in statistics. Beyond covering deep learning models for predictive modeling, focus on deep generative models. Besides explanations on a mathematical and conceptual level, emphasize the practical aspects of deep learning. Open-source computing provides hands-on experience for implementing deep neural nets, working on supervised learning tasks, and applying generative models for dataset synthesis.",3 credits.,MATH 320
STAT 456 — APPLIED MULTIVARIATE ANALYSIS,Theory and applications of multivariate statistical methods. Basic concepts and statistical reasoning which underlie the techniques of multivariate analysis. Ideas rather than derivations stressed although basic models discussed to give the student some feeling for their adequacy in particular situations. Acquaintance with and use of existing computer programs in the multivariate analysis area.,3 credits.,"STAT 333, STAT 340, MATH 320, MATH 375"
STAT 461 — FINANCIAL STATISTICS,"Stochastic models and statistical methodologies are widely employed in modern finance. The models and their inferences are very important for academic research and financial practices. Financial stochastic models and their statistical inferences with applications to volatility analysis and risk management, introduction to discrete models such as binomial trees and GARCH and stochastic volatility models as well as simple continuous models like the Black-Scholes model. The focus will be on statistical inference, data analysis and risk management regarding these models.",3 credits.,"STAT 333, ECON 410, STAT 311, MATH 331, MATH 531"
STAT/COMP SCI  471 — INTRODUCTION TO COMPUTATIONAL STATISTICS,"Classical statistical procedures arise where closed-form mathematical expressions are available for various inference summaries (e.g. linear regression; analysis of variance). A major emphasis of modern statistics is the development of inference principles in cases where both more complex data structures are involved and where more elaborate computations are required. Topics from numerical linear algebra, optimization, Monte Carlo (including Markov chain Monte Carlo), and graph theory are developed, especially as they relate to statistical inference (e.g., bootstrapping, permutation, Bayesian inference, EM algorithm, multivariate analysis).",3 credits.,"STAT 333, STAT 340"
STAT/COMP SCI/MATH  475 — INTRODUCTION TO COMBINATORICS,"Problems of enumeration, distribution, and arrangement. Inclusion-exclusion principle. Generating functions and linear recurrence relations. Combinatorial identities. Graph coloring problems. Finite designs. Systems of distinct representatives and matching problems in graphs. Potential applications in the social, biological, and physical sciences. Puzzles. Problem solving.",3 credits.,"MATH 320, MATH 375"
STAT 479 — SPECIAL TOPICS IN STATISTICS,Special topics of interest in undergraduate students.,1-3 credits.,None
STAT/COMP SCI/I SY E/MATH  525 — LINEAR OPTIMIZATION,"Introduces optimization problems whose constraints are expressed by linear inequalities. Develops geometric and algebraic insights into the structure of the problem, with an emphasis on formal proofs. Presents the theory behind the simplex method, the main algorithm used to solve linear optimization problems. Explores duality theory and theorems of the alternatives.",3 credits.,"MATH 320, MATH 443"
STAT/B M I  541 — INTRODUCTION TO BIOSTATISTICS,"Course designed for the biomedical researcher. Topics include: descriptive statistics, hypothesis testing, estimation, confidence intervals, t-tests, chi-squared tests, analysis of variance, linear regression, correlation, nonparametric tests, survival analysis and odds ratio. Biomedical applications used for each topic.",3 credits.,STAT 511
STAT/B M I  542 — INTRODUCTION TO CLINICAL TRIALS I,"Intended for biomedical researchers interested in the design and analysis of clinical trials. Topics include definition of hypotheses, measures of effectiveness, sample size, randomization, data collection and monitoring, and issues in statistical analysis.",3 credits.,None
STAT/F&W ECOL  571 — STATISTICAL METHODS FOR BIOSCIENCE I,"Descriptive statistics, distributions, one- and two-sample normal inference, power, one-way ANOVA, simple linear regression, categorical data, non-parametric methods; underlying assumptions and diagnostic work.",4 credits.,None
STAT/F&W ECOL  572 — STATISTICAL METHODS FOR BIOSCIENCE II,"Polynomial regression, multiple regression, two-way ANOVA with and without interaction, split-plot design, subsampling, analysis of covariance, elementary sampling, introduction to bioassay.",4 credits.,None
STAT 575 — STATISTICAL METHODS FOR SPATIAL DATA,"Detecting, quantifying, and modeling spatial patterns and structure in data. Variograms and covariance functions, linear predictions with uncertainty qualification, and conditional simulations. Spectral domain models and spectral densities. Spatial point processes. Contemporary applications and Gaussian process model fitting at scale.",3 credits.,"STAT 333, STAT 340, MATH 320, MATH 375"
STAT 601 — STATISTICAL METHODS I,"Provides a thorough grounding in modern statistical methods. The specific learning outcomes for the course are to understand data collection in context (how/why data were collected, key questions under study); explore data by effective graphical and numerical summaries; understand probability concepts and models as tools for studying random phenomena and for statistical inference; analyze data using appropriate, modern statistical models, methods, and software; understand the statistical concepts underlying methods; develop the ability to interpret results and critically evaluate the methods used; communicate data analysis and key findings in context.",4 credits.,None
STAT 602 — STATISTICAL METHODS II,"Provides a thorough grounding in modern statistical methods. The specific learning outcomes for the course are to understand data collection in context (how/why data were collected, key questions under study); explore data by effective graphical and numerical summaries; understand probability concepts and models as tools for studying random phenomena and for statistical inference; analyze data using appropriate, modern statistical models, methods, and software; understand the statistical concepts underlying methods; develop the ability to interpret results and critically evaluate the methods used; communicate data analysis and key findings in context.",4 credits.,STAT 601
STAT 605 — DATA SCIENCE COMPUTING PROJECT,"The development of tools necessary for collecting, managing, and analyzing large data sets. Examples of techniques and programs utilized include Linux, R, distributed computing, powerful editor(s), git/github, and other related tools. Work in the class will be done in teams to research, develop, write, and make presentations related to a variety of data analysis projects.",3 credits.,None
STAT 606 — COMPUTING IN DATA SCIENCE AND STATISTICS,"A survey of some of the tools and frameworks that are currently popular among data scientists and statisticians working in both academia and industry. Begins with an accelerated introduction to the Python programming language and brief introductions to object-oriented and functional programming. Covers some of the scientific computing platforms available in Python, including tools for numerical and scientific computing; training basic machine learning models; and data visualization. Discusses collecting data from the web both by scraping and using APIs. Concludes with a brief survey of distributed computing platforms, focusing on the MapReduce framework.",3 credits.,None
STAT 609 — MATHEMATICAL STATISTICS I,"Review of probability, random variables and vectors and their distributions, moments and inequalities, generating functions, transformations of random variables, sampling and distribution theory, convergence concepts for sequences of random variables, laws of large numbers, central limit and other limit theorems.",3 credits.,None
STAT 610 — INTRODUCTION TO STATISTICAL INFERENCE,"Conditioning, distribution theory, approximation to distributions, modes of convergence, limit theorems, statistical models, parameter estimation, comparision of estimators, confidence sets, theory of hypothesis tests, introduction to Bayesian inference and nonparametric estimation.",4 credits.,None
STAT 611 — STATISTICAL MODELS FOR DATA SCIENCE,"Probability, random variables and their distributions, joint and conditional distributions, moments and inequalities, generating functions, transformations of random variables, sampling and distribution theory, convergence concepts and limit theorems for sequences of random variables.",3 credits.,None
STAT 612 — STATISTICAL INFERENCE FOR DATA SCIENCE,"Statistical models, methods and theory for parameter estimation, Bayesian approach to parameter estimation, methods and theory for hypothesis tests, confidence sets, two-sample testing and ANOVA, categorical data analysis, linear regression.",3 credits.,STAT 611
STAT 613 — STATISTICAL METHODS FOR DATA SCIENCE,"Provides a thorough grounding in modern statistical methods. Introduces statistical techniques and methods of data analysis, including data description, linear regression models, diagnostic tools, prediction and model selection, and experimental design.",3 credits.,None
STAT 615 — STATISTICAL LEARNING,"The development of a variety of mathematical theories and statistical concepts (1) to understand the properties of those models and methods used for the purpose of prediction from data or decision making from data, and (2) to criticize such models, methods and their consequences. Specifically, the theories and tools that will be developed will include complexity theory, Hilbert spaces, Gaussian processes, Variational Analysis, and concentration inequalities.",3 credits.,None
STAT/B M I  620 — STATISTICS IN HUMAN GENETICS,"Provides a comprehensive survey of statistical methods in human genetics research. Covered topics include linkage analysis, genome-wide association study, rare variant association analysis, meta-analysis, genome and variant annotation, heritability estimation, multi-trait modeling techniques, multi-omic data integration, and genetic risk prediction.",3 credits.,STAT 333
STAT 627 — PROFESSIONAL SKILLS IN DATA SCIENCE,"Covers important aspects of professional development in statistics, including skills with internet tools, sophisticated use of statistical languages (such as R) and other emerging topics.",1-3 credits.,None
STAT 628 — DATA SCIENCE PRACTICUM,"Provides an understanding of and experience with turning statistics concepts into practice through data science practicums inspired by realistic projects. Combine theory and methods expertise with communications skills to translate from a vaguely stated project description and complex data set into a concisely summarized analysis, including both written and graphical interpretation that can be used by decision makers in an organization.",3 credits.,None
STAT/I SY E/MATH/OTM  632 — INTRODUCTION TO STOCHASTIC PROCESSES,"Topics include discrete-time Markov chains, Poisson point processes, continuous-time Markov chains, and renewal processes. Applications to queueing, branching, and other models in science, engineering and business.",3 credits.,"STAT 311, MATH 531, MATH 320, MATH 531"
STAT/B M I  641 — STATISTICAL METHODS FOR CLINICAL TRIALS,"Statistical issues in the design of clinical trials, basic survival analysis, data collection and sequential monitoring.",3 credits.,None
STAT/B M I  642 — STATISTICAL METHODS FOR EPIDEMIOLOGY,"Methods for analysis of case-control, cross sectional, and cohort studies. Covers epidemiologic study design, measures of association, rates, classical contingency table methods, and logistic and Poisson regression.",3 credits.,None
"STAT/B M I  643 — CLINICAL TRIAL DESIGN, IMPLEMENTATION, AND ANALYSIS","Gain an understanding of fundamental elements of clinical trials (such as objectives, endpoints, surrogate endpoints, and statistical decisions) and statistical design considerations (such as randomization and blinding). Designs of clinical trials for Phase I, II, and III studies including single-arm, two-arm, and drug combination trials. Introduction to adaptive designs for precision medicine and master protocol designs such as umbrella trials and basket trials.",3 credits.,STAT 609
STAT 678 — INTRODUCTION TO STATISTICAL CONSULTING,"Develop statistical consulting skills to be able to communicate design and analysis to non-technical research collaborators. Provides a supportive environment to experiment with statistical consulting in practice, which will sometimes be uncomfortable and strange. Consulting problems typically do not have a ""right"" answer, and mistakes are encouraged. Take risks in sharing developing ideas in class. Connections with external organizations, such as the private sector and government agencies, will be made through possible internship experiences.",3 credits.,None
STAT 679 — SPECIAL TOPICS IN STATISTICS,Special topics in statistics at the master's level. Subject matter varies.,1-3 credits.,None
STAT 681 — SENIOR HONORS THESIS,"Mentored individual study for students writing honors thesis, as arranged with a faculty member.",3 credits.,None
STAT 682 — SENIOR HONORS THESIS,"Mentored individual study for students writing honors thesis, as arranged with a faculty member.",3 credits.,None
